name;location;price_range_min;price_range_max;room_with_open_air_bath;rental_open_air_tubs;rental_indoor_tubs;rental_both_indoor_outdoor_tubs;tripadvisor_rating;tags;description;transportation;lat;lon;url
Naspa New Otani;2117-9 Yuzawa, Yuzawa-machi, Minamiuonuma-gun, Niigata, Japan;14800;60800;0;False;True;False;4.2;['Rental hot spring baths for private use', 'Mountain view', 'Tokyo suburbs', 'Niigata', 'Echigo Yuzawa Onsen'];Book Naspa New Otani in Echigo Yuzawa Onsen (Niigata) The view of the mountains from the rooms is beautiful. With two types of private-use hot spring baths. There is a ski resort with eight courses located nearby that can be enjoyed during the winter (Snowboarding is prohibited);;36.9438956;138.8068511;https://selected-ryokan.com/ryokan/naspa-new-otani_echigo-yuzawa_niigata_tokyo-suburbs.html
Teisho Basaratei;3618-74 Ugata, Ago-cho, Shima-shi, Mie, Japan;44000;97900;1;True;True;False;3.9;['Rooms with private open-air baths', 'Rental hot spring baths for private use', 'All rooms have open-air hot spring', 'Sea view', 'Nagoya Chubu & Hokuriku Region', 'Mie', 'Ise-Shima Onsen'];Book Teisho Basaratei in Ise-Shima Onsen (Mie) This Japanese ryokan is located on an elevated plateau facing Ago Bay. Situated within a 5,000 tsubo (approximately 16,500 square meters) property, the ryokan features 20 rooms, including five detached villas and 15 rooms in the main building, all with open-air baths. Meals are made with local ingredients, including seafood, and are served in fully private dining rooms.;(1) Two hours 10 minutes by Kintetsu Limited Express from Kintetsu Nagoya Station to Kashikojima Station, then 3 minutes by shuttle bus (2) Two hours 30 minutes by Kintetsu Limited Express from Osaka-Namba Station to Kashikojima Station, then 3 minutes by shuttle bus The required times may slightly vary depending on the time of day. | (1) Two hours 10 minutes by Kintetsu Limited Express from Kintetsu Nagoya Station to Kashikojima Station, then 3 minutes by shuttle bus | (2) Two hours 30 minutes by Kintetsu Limited Express from Osaka-Namba Station to Kashikojima Station, then 3 minutes by shuttle bus;34.32815584;136.82971566;https://selected-ryokan.com/ryokan/teisho-basaratei_ise-shima_mie_nagoya-chubu.html
Hotel Grandmer Sankaiso;1 Naruto, Maito-cho, Ajigasawa-machi, Nishitsugaru-gun, Aomori, Japan;19400;44800;0;False;True;False;4.5;['Rental hot spring baths for private use', 'Enjoy hot spring in snow', 'Sea view', 'Tohoku Region', 'Aomori', 'Hirosaki Onsen', 'Aomori (Aomori Airport)'];Book Hotel Grandmer Sankaiso in Hirosaki Onsen (Aomori) As a ryokan merging Japanese and western elements and creating a retro feel, it boasts a great location surrounded by the Sea of Japan with a gorgeous view of the sunset, Mount Iwaki which is also referred to as Tsugaru-Fuji due to its shape, and the UNESCO World Natural Heritage Site Shirakami-Sanchi. Seasonal scenery of the Sea of Japan, such as the glorious setting sun and raging waves in winter, can be viewed from the open-air baths. There are also two rental hot springs outside the rooms for private use. It is a sister ryokan of Suigun no Yado.;(1) 55 minutes by bus from Aomori Airport to Hirosaki Station, then one hour 10 minutes by JR Limited Express to Ajigasawa Station and 5-min shuttle bus ride from there (Advance booking required) (2) Three hours 10 minutes by JR Tohoku Shinkansen from Tokyo Station to Shin-Aomori Station, then one hour 30 minutes by JR Limited Express to Ajigasawa Station and 5-min shuttle bus ride from there (Advance booking required) The required times may slightly vary depending on the time of day. | (1) 55 minutes by bus from Aomori Airport to Hirosaki Station, then one hour 10 minutes by JR Limited Express to Ajigasawa Station and 5-min shuttle bus ride from there (Advance booking required) | (2) Three hours 10 minutes by JR Tohoku Shinkansen from Tokyo Station to Shin-Aomori Station, then one hour 30 minutes by JR Limited Express to Ajigasawa Station and 5-min shuttle bus ride from there (Advance booking required);40.779739641948;140.235456815099;https://selected-ryokan.com/ryokan/hotel-grandmer-sankaiso_hirosaki_aomori_tohoku.html
Hamanoyu;3-3-10 Kogandori, Suwashi, Nagano 329-0027 Japan;19300;72600;1;False;True;False;3.9;['Rooms with private open-air baths', 'Rental hot spring baths for private use', 'Lake view', 'Tokyo suburbs', 'Nagano', 'Lake Suwa & Tateshina Onsen'];Book Hamanoyu in Lake Suwa Onsen (Nagano) A hot spring ryokan brimming with relaxation, where guests can spend time near Lake Suwa, a home of Japanese myth and legend. Taiji Harada, an artist creating in the motif of Japans primal scene, has stayed at this ryokan.;;36.04897077477;138.114513027535;https://selected-ryokan.com/ryokan/hamanoyu_kamisuwa_nagano_tokyo-suburbs.html
Heiseikan Shiosaitei;1-2-7 Yunokawa-cho, Hakodate-shi, Hokkaido, Japan;14500;32000;42;False;False;False;4.0;['Rooms with private open-air baths', 'Sea view', 'Hokkaido Region', 'Hokkaido', 'Hakodate Yunokawa Onsen', 'Hakodate (Hakodate Airport)'];Book Heiseikan Shiosaitei in Hakodate Yunokawa Onsen (Hokkaido) Standing next to the sea. Twenty-two guest rooms with open-air baths that command a view of the ocean.;(1) 8 minutes by bus from Hakodate Airport to Yunokawa Onsen, then 2 minutes on foot from there (2) Five hours 50 minutes by bus from Sapporo Station to Yunokawa Onsen, then 2 minutes on foot (3) Three hours 45 minutes by JR Limited Express from Sapporo Station to Hakodate Station, then 30 minutes by Hakodate City Tram to Yunokawa Onsen Station, and 8-min walk from there (4) 3 minutes by JR Chitose Line from New Chitose Airport to Minami-Chitose Station, then three hours 15 minutes by JR Limited Express to Hakodate Station and 12-min taxi ride from there The required times may slightly vary depending on the time of day. | (1) 8 minutes by bus from Hakodate Airport to Yunokawa Onsen, then 2 minutes on foot from there | (2) Five hours 50 minutes by bus from Sapporo Station to Yunokawa Onsen, then 2 minutes on foot | (3) Three hours 45 minutes by JR Limited Express from Sapporo Station to Hakodate Station, then 30 minutes by Hakodate City Tram to Yunokawa Onsen Station, and 8-min walk from there | (4) 3 minutes by JR Chitose Line from New Chitose Airport to Minami-Chitose Station, then three hours 15 minutes by JR Limited Express to Hakodate Station and 12-min taxi ride from there;41.774003972194;140.785991195955;https://selected-ryokan.com/ryokan/heiseikan-shiosaitei_hakodate-yunokawa_hokkaido.html
Toba Kokusai Hotel Shiojitei;1-23-1 Toba, Toba-shi, Mie, Japan;29500;109400;1;False;False;False;4.2;['Rooms with private open-air baths', 'Nagoya Chubu & Hokuriku Region', 'Mie', 'Ise-Shima Onsen'];Book Toba Kokusai Hotel Shiojitei in Ise-Shima Onsen (Mie) A modern Japanese inn facing the calm Toba Bay. 20 minutes by taxi to Ise Jingu (Ise Grand Shrine). You can enjoy a Pearl Aurora Bath containing substances found in pearls, which was developed by a company in the MIKIMOTO Group that successfully farmed pearls for the first time in the world.;(1) One hour 45 minutes by JR/Kintetsu Limited Express from Nagoya Station to Toba Station, then 3 minutes by shuttle bus (2) Two hours by Kintetsu Limited Express from Osaka Nanba Station to Toba Station, then 3 minutes by shuttle bus The required times may slightly vary depending on the time of day. | (1) One hour 45 minutes by JR/Kintetsu Limited Express from Nagoya Station to Toba Station, then 3 minutes by shuttle bus | (2) Two hours by Kintetsu Limited Express from Osaka Nanba Station to Toba Station, then 3 minutes by shuttle bus;34.4878945;136.8404207;https://selected-ryokan.com/ryokan/toba-kokusai-hotel-shiojitei_ise-shima_mie_nagoya-chubu.html
Takinoyu;1-1-30, Kamata-Honcho, Tendo-shi, Yamagata 994-0025 Japan;19300;53500;1;False;False;False;4.4;['Rooms with private open-air baths', 'Enjoy hot spring in snow', 'Tohoku Region', 'Yamagata', 'Tendo Onsen', 'Yamagata (Yamagata Airport)'];Book Takinoyu in Tendo Onsen (Yamagata) Renovated in 2006, this ryokan is both new and comfortable. Being welcomed by smiling faces is pretty attractive.;(1) 20 minutes by shared-taxi from Yamagata Airport (Advance booking required) (2) Three hours by JR Shinkansen from Tokyo Station to Tendo Station, then 5 minutes by shuttle bus (Advance booking required) The required times may slightly vary depending on the time of day. | (1) 20 minutes by shared-taxi from Yamagata Airport (Advance booking required) | (2) Three hours by JR Shinkansen from Tokyo Station to Tendo Station, then 5 minutes by shuttle bus (Advance booking required);38.358727953564;140.380801111637;https://selected-ryokan.com/ryokan/takinoyu_tendo_yamagata_tohoku.html
Gero Kanko Hotel;1113 Koden, Gero-shi, Gifu, 509-2206 Japan;15800;42900;12;True;False;False;3.9;['Rooms with private open-air baths', 'Rental hot spring baths for private use', 'Enjoy hot spring in snow', 'River view', 'Nagoya Chubu & Hokuriku Region', 'Gifu', 'Gero Onsen'];Book Gero Kanko Hotel in Gero Onsen (Gifu) Ranked best in superb city views. A hot spring hotel with a superb night view and tranquility that was ranked number one in Ureta Yado(small scale category).;;35.8054009;137.2385033;https://selected-ryokan.com/ryokan/gero-kanko-hotel_gifu_nagoya-chubu-hokuriku.html
Satoyu Mukashibanashi Yuzanso, Lake Biwa;1-9-28 Ogoto, Otsu-shi, Shiga, Japan;23100;63800;53;False;False;False;3.8;['Rooms with private open-air baths', 'Lake view', 'Osaka Kyoto Kansai Region', 'Kyoto Onsen', 'Shiga'];Book Satoyu Mukashibanashi Yuzanso in Kyoto Lake Biwa Onsen (Shiga) An inn looking out on Lake Biwa not far from Kyoto. Fifty-one rooms that come with open-air baths.;;35.090189;135.899037;https://selected-ryokan.com/ryokan/satoyu-mukashibanashi-yuzanso_ogoto_shiga_kyoto_kansai.html
Hotel Kawakyu;3745 Shirahama-cho, Nishimuro-gun, Wakayama, Japan;22000;254500;2;False;False;False;3.9;['Rooms with private open-air baths', 'Sea view', 'Osaka Kyoto Kansai Region', 'Wakayama', 'Nanki Shirahama Onsen', 'Shirahama (Nanki Shirahama Airport)'];Book Hotel Kawakyu in Nanki Shirahama Onsen (Wakayama) All rooms offer a view of the ocean. All rooms are suite rooms. An inn resembling a western-style castle standing by the ocean. Guests can enjoy hot spring baths within the facilities.;(1) 20 minutes by bus from Nanki Shirahama Airport to Shirahama Station, then 10 minutes by shuttle bus (2) 10 minutes by JR Kansai Airport Line from Kansai International Airport to Hineno Station, then one hour 50 minutes by JR Limited Express to Shirahama Station and 10-min shuttle bus ride from there (3) Two hours 30 minutes by JR Limited Express from Osaka Station to Shirahama Station, then 10 minutes by shuttle bus The required times may slightly vary depending on the time of day. | (1) 20 minutes by bus from Nanki Shirahama Airport to Shirahama Station, then 10 minutes by shuttle bus | (2) 10 minutes by JR Kansai Airport Line from Kansai International Airport to Hineno Station, then one hour 50 minutes by JR Limited Express to Shirahama Station and 10-min shuttle bus ride from there | (3) Two hours 30 minutes by JR Limited Express from Osaka Station to Shirahama Station, then 10 minutes by shuttle bus;33.6781748;135.3479399;https://selected-ryokan.com/ryokan/hotel-kawakyu_nanki-shirahama_wakayama_kansai.html
Sukayu Onsen Ryokan;50 SukayuzawaAza Minami arakawa, Arakawa, Aomori-shi, Aomori, 030-0111 Japan;9900;24200;0;False;False;False;4.2;['Interesting hot springs', 'Traditional Japanese architecture', 'Mountain view', 'Tohoku Region', 'Aomori', 'Oirase & Hakkoda Onsen', 'Aomori (Aomori Airport)'];Book Sukayu Onsen Ryokan in Oirase & Hakkoda Onsen (Aomori) A tasteful hidden bath with a pure and rustic ambiance set amidst a 900 meter highland in the Hakkoda mountain system. Ryokan where staff members and actors from the movie Hakkodasan (1977, Japan) stayed. It is a sister ryokan of Hakkoda Hotel.;(1) 35 minutes by bus from Aomori Airport to Aomori Station, then one hour by shuttle bus (Advance booking required) (2) Three hours 10 minutes by JR Tohoku Shinkansen from Tokyo Station to Shin-Aomori Station, then 6 minutes by JR Ouu Main Line to Aomori Station and one-hour shuttle bus ride from there (Advance booking required) The required times may slightly vary depending on the time of day. | (1) 35 minutes by bus from Aomori Airport to Aomori Station, then one hour by shuttle bus (Advance booking required) | (2) Three hours 10 minutes by JR Tohoku Shinkansen from Tokyo Station to Shin-Aomori Station, then 6 minutes by JR Ouu Main Line to Aomori Station and one-hour shuttle bus ride from there (Advance booking required);40.691998772;140.775956288;https://selected-ryokan.com/ryokan/sukayu-onsen-ryokan_aomori_tohoku.html
Haifu;524 Watakano, Isobe-cho, Shima-shi, Mie, Japan;23500;50600;1;True;False;False;4.4;['Rooms with private open-air baths', 'Rental hot spring baths for private use', 'All rooms have open-air hot spring', 'Sea view', 'Nagoya Chubu & Hokuriku Region', 'Mie', 'Ise-Shima Onsen'];Book Haifu in Ise-Shima Onsen (Mie) This ryokan is situated on a remote island in Iseshima, where all rooms come with open-air hot spring baths offering a panoramic view of the calm sea. Guests can enjoy a three-minute cruise on a private boat to reach the inn. Dinner features dishes made with locally branded ingredients.;(1) Two hours 10 minutes by Kintetsu Limited Express from Kintetsu Nagoya Station to Toba Station, then 15 minutes by shuttle bus (reserve in advance) to Wataka-no-Tosenba (Wataka port) and 3-min ferry ride from there (2) Two hours 25 minutes by Kintetsu Limited Express from Osaka-Namba Station to Toba Station, then 15 minutes by shuttle bus (reserve in advance) to Wataka-no-Tosenba (Wataka port) and 3-min ferry ride from there The required times may slightly vary depending on the time of day. | (1) Two hours 10 minutes by Kintetsu Limited Express from Kintetsu Nagoya Station to Toba Station, then 15 minutes by shuttle bus (reserve in advance) to Wataka-no-Tosenba (Wataka port) and 3-min ferry ride from there | (2) Two hours 25 minutes by Kintetsu Limited Express from Osaka-Namba Station to Toba Station, then 15 minutes by shuttle bus (reserve in advance) to Wataka-no-Tosenba (Wataka port) and 3-min ferry ride from there;34.32815584;136.82971566;https://selected-ryokan.com/ryokan/haifu_ise-shima_mie_nagoya-chubu.html
Arima Onsen Kotori;353-1, Arima-cho, Kita-ku, Kobe-shi, Hyogo, Japan;16500;63300;1;True;False;False;4.0;['Rooms with private open-air baths', 'Rental hot spring baths for private use', 'Osaka Kyoto Kansai Region', 'Hyogo', 'Arima Onsen'];Book Arima Onsen Kotori in Arima Onsen (Hyogo) An inn resembling a luxurious private mansion. A cozy little establishment with a total of eight rooms. Guests can enjoy bathing in a transparent-colored hot spring (silver spring) bath. Enjoy a private-use hot spring bath and a large public bath at the other building (Arima Onsen Miyukiso Hanamusubi), brown-colored hot spring bath (gold spring).;(1) One hour 5 minutes by bus from Kansai International Airport to Kobe Sannomiya Bus Terminal, then 30 minutes by bus to Arima Onsen and 4-min shuttle bus ride (or 10 minutes on foot) from there (2) One hour by bus from Hankyu Highway Bus Osaka Umeda Terminal (Hankyu Sambangai) to Arima Onsen, then 3 minutes by shuttle bus (or 10 minutes on foot) (3) One hour 15 minutes by bus from Kyoto Station to Arima Onsen, then 3 minutes by shuttle bus (or 10 minutes on foot) (4) 10 minutes by Kobe Municipal Subway from Kobe Sannomiya Station to Tanigami Station, 10 minutes by Kobe Electric Railway from Tanigami Station to Arimaguchi Station, then 5 minutes by Kobe Electric Railway Arima Line to Arima Onsen Station and 4-min shuttle bus ride (or 12 minutes on foot) from there The required times may slightly vary depending on the time of day. | (1) One hour 5 minutes by bus from Kansai International Airport to Kobe Sannomiya Bus Terminal, then 30 minutes by bus to Arima Onsen and 4-min shuttle bus ride (or 10 minutes on foot) from there | (2) One hour by bus from Hankyu Highway Bus Osaka Umeda Terminal (Hankyu Sambangai) to Arima Onsen, then 3 minutes by shuttle bus (or 10 minutes on foot) | (3) One hour 15 minutes by bus from Kyoto Station to Arima Onsen, then 3 minutes by shuttle bus (or 10 minutes on foot) | (4) 10 minutes by Kobe Municipal Subway from Kobe Sannomiya Station to Tanigami Station, 10 minutes by Kobe Electric Railway from Tanigami Station to Arimaguchi Station, then 5 minutes by Kobe Electric Railway Arima Line to Arima Onsen Station and 4-min shuttle bus ride (or 12 minutes on foot) from there;34.7966761;135.2515303;https://selected-ryokan.com/ryokan/arima-onsen-kotori_hyogo_kansai.html
Infinito Hotel & Spa Nanki Shirahama;2018, Shirahama-cho, Nishimuro-gun, Wakayama, Japan;25900;93100;8;False;False;False;3.8;['Rooms with private open-air baths', 'Sea view', 'Osaka Kyoto Kansai Region', 'Wakayama', 'Nanki Shirahama Onsen', 'Shirahama (Nanki Shirahama Airport)'];Book Infinito Hotel & Spa Nanki Shirahama in Nanki Shirahama Onsen (Wakayama) Enjoy the ryokan while viewing the Pacific Ocean from above. The view of the sea from spots such as the room and open-air hot spring baths is beautiful.;(1) 20 minutes by bus from Nanki Shirahama Airport to Shirahama Station, then 15 minutes by shuttle bus (Advance booking required) (2) 10 minutes by JR Kansai Airport Line from Kansai International Airport to Hineno Station, then one hour 50 minutes by JR Limited Express to Shirahama Station and 15-min shuttle bus ride from there (Advance booking required) (3) Two hours 30 minutes by JR Limited Express from Osaka Station to Shirahama Station, then 15 minutes by shuttle bus (Advance booking required) The required times may slightly vary depending on the time of day. | (1) 20 minutes by bus from Nanki Shirahama Airport to Shirahama Station, then 15 minutes by shuttle bus (Advance booking required) | (2) 10 minutes by JR Kansai Airport Line from Kansai International Airport to Hineno Station, then one hour 50 minutes by JR Limited Express to Shirahama Station and 15-min shuttle bus ride from there (Advance booking required) | (3) Two hours 30 minutes by JR Limited Express from Osaka Station to Shirahama Station, then 15 minutes by shuttle bus (Advance booking required);33.6781748;135.3479399;https://selected-ryokan.com/ryokan/infinito-hotel-spa_nanki-shirahama_wakayama_kansai.html
Sosen no Yado Suhaku;3-2-2 Kogan-dori, Suwa-shi, Nagano, Japan;22100;49000;0;False;False;True;4.1;['Rental hot spring baths for private use', 'Lake view', 'Tokyo suburbs', 'Nagano', 'Lake Suwa & Tateshina Onsen'];Book Sosen no Yado Suhaku in Lake Suwa Onsen (Nagano) Situated by Lake Suwa, it is a 8-minute walk from JR Kami-Suwa Station. The 42 guest rooms here include rooms that offer a birds-eye view of Lake Suwa, wa-yo-shitsu (Japanese-western rooms) consisting of a Japanese-style portion and a western-style portion in the same room, and others. There are two spring sources inside the ryokan grounds, each providing spring water of a different colour. You can enjoy both types of hot springs at the large public baths with open-air baths which command a great view of Lake Suwa.;;36.049596316204;138.113137138129;https://selected-ryokan.com/ryokan/sosen-no-yado-suhaku_lake-suwa_nagano_tokyo-suburbs.html
Zao Hot Spring Gokan no Yu Tsuruya;710 Zao Onsen, Yamagata-shi, Yamagata, Japan;15400;27500;0;False;True;False;4.3;['Rental hot spring baths for private use', 'Enjoy hot spring in snow', 'Tohoku Region', 'Yamagata', 'Zao Onsen', 'Yamagata (Yamagata Airport)'];Book Zao Hot Spring Gokan no Yu Tsuruya in Zao Onsen (Yamagata) With four types of private-use hot spring baths. A beautiful view of the mountains from the large open-air public hot springs and the rooms. 3 min by walk to the ropeway station bound for the peak of Mount Zao.;(1) One hour by shared-taxi from Yamagata Airport to Zao Onsen Bus Terminal (advance booking required), or (2) two hours 45 minutes by JR Shinkansen from Tokyo Station to Yamagata Station, then 35 minutes by bus to Zao Onsen Bus Terminal and 1-min walk from there The required times may slightly vary depending on the time of day. | (1) One hour by shared-taxi from Yamagata Airport to Zao Onsen Bus Terminal (advance booking required), or (2) two hours 45 minutes by JR Shinkansen from Tokyo Station to Yamagata Station, then 35 minutes by bus to Zao Onsen Bus Terminal and 1-min walk from there;38.1679266;140.4003442;https://selected-ryokan.com/ryokan/gokan-no-yu-tsuruya_zao_yamagata_tohoku.html
Choueikan;6-7 Oshuku, Shizukuishi-cho, Iwate-gun, Iwate, Japan;15000;37000;0;False;False;False;4.5;['Tohoku Region', 'Iwate', 'Tsunagi-Oshuku Onsen', 'Hanamaki (Iwate Hanamaki Airport)'];Book Choueikan in Oshuku Onsen (Iwate) You can experience highly concentrated hot spring with no water added. Savor Japanese kaiseki cuisine for dinner and breakfast at an authentic inn. 25 minutes by car to Koiwai Farm.;(1) 45 minutes by bus from Iwate Hanamaki Airport to Morioka Station, then 15 minutes by JR Tazawako Line to Shizukuishi Station and 15-min shuttle bus ride from there (Advance booking required) (2) Two hours 30 minutes by JR Akita Shinkansen from Tokyo Station to Shizukuishi Station, then 15 minutes by shuttle bus (Advance booking required) The required times may slightly vary depending on the time of day. | (1) 45 minutes by bus from Iwate Hanamaki Airport to Morioka Station, then 15 minutes by JR Tazawako Line to Shizukuishi Station and 15-min shuttle bus ride from there (Advance booking required) | (2) Two hours 30 minutes by JR Akita Shinkansen from Tokyo Station to Shizukuishi Station, then 15 minutes by shuttle bus (Advance booking required);39.63584952;140.92131601;https://selected-ryokan.com/ryokan/choueikan_tsunagi-oshuku_iwate_tohoku.html
Honke Bankyu;749 Yunishigawa, Nikko-shi, Tochigi;24000;48400;6;True;False;False;4.3;['Rooms with private open-air baths', 'Rental hot spring baths for private use', 'Enjoy hot spring in snow', 'Traditional Japanese architecture', 'River view', 'Mountain view', 'Tokyo suburbs', 'Tochigi', 'Yunishigawa Onsen'];Book Honke Bankyu in Yunishigawa Onsen (Tochigi) The chirping of birds, the tranquil murmuring of the river, the pulse of mountain life... Melt away in a luxurious bath accompanied only by the relaxing sounds of nature. The open air bath is a hot spring that has continued to spout for 820 years. With its use of old trees, the main building is often featured in magazines.;;36.961946150736;139.589738882887;https://selected-ryokan.com/ryokan/honke-bankyu_yunishikawa_tochigi_tokyo-suburbs.html
Awaji Yumesenkei;1052-2 Orodani, Sumoto-shi, Hyogo, Japan;19800;36300;8;True;True;False;4.2;['Rooms with private open-air baths', 'Rental hot spring baths for private use', 'Interesting hot springs', 'Sea view', 'Osaka Kyoto Kansai Region', 'Hyogo', 'Awaji Island (Sumoto) Onsen'];Book Awaji Yusenkei in Awaji Island Sumoto Onsen (Hyogo) There are three types of rooms 1. Riraku: ocean-view rooms on special luxury floors, 2. Comfort Floor : harbour-view rooms on the top floor, and 3. Shotokaku: standard guest rooms. Exclusive lounges for staying guests are available at Riraku and Comfort Floor.;(1) One hour 20 minutes by bus from Kobe Sannomiya Station to Sumoto Bus Center, then 5 minutes by shuttle bus (2) One hour 30 minutes by bus from Tokushima Station to Sumoto Bus Center, then 5 minutes by shuttle bus (3) Two hours 30 minutes by bus from Osaka Station to Sumoto Bus Center, then 5 minutes by shuttle bus The required times may slightly vary depending on the time of day. | (1) One hour 20 minutes by bus from Kobe Sannomiya Station to Sumoto Bus Center, then 5 minutes by shuttle bus | (2) One hour 30 minutes by bus from Tokushima Station to Sumoto Bus Center, then 5 minutes by shuttle bus | (3) Two hours 30 minutes by bus from Osaka Station to Sumoto Bus Center, then 5 minutes by shuttle bus;34.3318879;134.9094988;https://selected-ryokan.com/ryokan/awaji-yumesenkei-sumoto_hyogo_kobe.html
Hakone Gora Byakudan;1297-5 Ninotaira, Hakone-machi, Ashigarashimo-gun, Kanagawa, Japan;37400;113300;1;False;False;False;4.3;['Rooms with private open-air baths', 'All rooms have open-air hot spring', 'Mountain view', 'Tokyo suburbs', 'Kanagawa', 'Hakone Onsen'];Book Hakone Gora Byakudan in Hakone Onsen (Kanagawa) All sixteen rooms come with open-air baths where you can enjoy fresh hot spring water straight from the source. A small luxury inn, where guests can enjoy fantastic views of nature from the room terraces.;(1) One hour 30 minutes by Odakyu Limited Express from Shinjuku Station to Hakone-Yumoto Station, then 35 minutes by Hakone Tozan Railway to Kowakidani Station and 5-min shuttle bus ride from there (Advance booking required) (2) 35 minutes by JR Shinkansen from Tokyo Station to Odawara Station, then 35 minutes by bus to Midori no Mura Iriguchi and 2-min walk from there The required times may slightly vary depending on the time of day. | (1) One hour 30 minutes by Odakyu Limited Express from Shinjuku Station to Hakone-Yumoto Station, then 35 minutes by Hakone Tozan Railway to Kowakidani Station and 5-min shuttle bus ride from there (Advance booking required) | (2) 35 minutes by JR Shinkansen from Tokyo Station to Odawara Station, then 35 minutes by bus to Midori no Mura Iriguchi and 2-min walk from there;35.2423589;139.0468904;https://selected-ryokan.com/ryokan/hakone-gora-byakudan_kanagawa_tokyo-suburbs.html
