name;location;price_range_min;price_range_max;room_with_open_air_bath;rental_open_air_tubs;rental_indoor_tubs;rental_both_indoor_outdoor_tubs;tripadvisor_rating;tags;description;transportation;lat;lon;url
Okuyugawara Yui;683-25 Miyakami, Yugawara-machi, Ashigarashimo-gun, Kanagawa, Japan;116000;186500;1;False;False;False;4.4;['Rooms with private open-air baths', 'All rooms have open-air hot spring', 'Japanese garden view', 'Tokyo suburbs', 'Kanagawa', 'Hakone Onsen'];Book Okuyugawara Yui in Hakone Onsen (Kanagawa) The Japanese garden and Japanese structures create a pleasant atmosphere. A small luxury inn, where guests can enjoy fantastic views of nature from the room terraces.;(1) One hour 15 minutes by JR Limited Express from Tokyo Station to Yugawara Station, then 10 minutes by taxi (or 25 minutes by bus to Okuyugawara and 7-min walk from there) (2) 35 minutes by JR Shinkansen from Tokyo Station to Odawara Station, then 25 minutes by JR Tokaido Main Line to Yugawara Station and 10-min taxi ride from there The required times may slightly vary depending on the time of day. | (1) One hour 15 minutes by JR Limited Express from Tokyo Station to Yugawara Station, then 10 minutes by taxi (or 25 minutes by bus to Okuyugawara and 7-min walk from there) | (2) 35 minutes by JR Shinkansen from Tokyo Station to Odawara Station, then 25 minutes by JR Tokaido Main Line to Yugawara Station and 10-min taxi ride from there;35.162860194763;139.060012492845;https://selected-ryokan.com/ryokan/okuyugawara-yui_hakone_kanagawa_tokyo-suburbs.html
Suizantei Club Jozankei;2-10 Jozankei Onsen Nishi, Minami-ku, Sapporo City, Hokkaido, Japan;34700;52600;4;False;False;False;4.4;['Rooms with private open-air baths', 'All rooms have hot spring baths', 'Safe ryokans under the COVID-19 (coronavirus) pandemic', 'Hokkaido Region', 'Hokkaido', 'Sapporo Onsen', 'Jozankei Onsen', 'Sapporo (New Chitose Airport)'];Book Suizantei Club Jozankei in Jozankei Onsen (Hokkaido) All rooms have indoor hot spring baths. Rooms are spacious at 56 square meters or more in area. A relaxing and modern Japanese-style inn surrounded by nature.;(1) One hour by shuttle bus from Sapporo (near Odori Park) (Advance booking required) (2) One hour 10 minutes by bus from Sapporo Station to Daiichi Hotel Mae, then 7 minutes on foot (3) One hour 50 minutes by bus from New Chitose Airport to Daiichi Hotel Mae, then 7 minutes on foot The required times may slightly vary depending on the time of day. | (1) One hour by shuttle bus from Sapporo (near Odori Park) (Advance booking required) | (2) One hour 10 minutes by bus from Sapporo Station to Daiichi Hotel Mae, then 7 minutes on foot | (3) One hour 50 minutes by bus from New Chitose Airport to Daiichi Hotel Mae, then 7 minutes on foot;42.971627271255;141.165861981532;https://selected-ryokan.com/ryokan/suizantei-club-jozankei_sapporo_hokkaido.html
Yukairo Kikuya;874-1 Shuzenji, Izu-shi, Shizuoka, Japan;24200;86900;27;True;True;False;4.0;['Rooms with private open-air baths', 'Rental hot spring baths for private use', 'Tokyo suburbs', 'Shizuoka', 'Shuzenji Onsen', 'Shizuoka (Mount Fuji Shizuoka Airport)'];Book Yukairo Kikuya in Shuzenji Onsen (Shizuoka) With a history of over 380 years, many famous persons including the prominent novelist Natsume Soseki had stayed at this ryokan. You can choose from the vintage main building, the new building that incorporates modern elements, and the detached guest rooms equipped with private open-air onsen baths, based on your personal preference. Meals are served at a restaurant, and you can choose either Japanese food or western food for breakfast.;(1) Two hours 10 minutes by JR Limited Express from Tokyo Station to Shuzenji Station, then 8 minutes by bus to Shuzenji Onsen and 1-min walk from there (2) One hour by bus from Mount Fuji Shizuoka Airport to Shizuoka Station, 25 minutes by JR Shinkansen from Shizuoka Station to Mishima Station, 30 minutes by Izu-Hakone Railway from Mishima Station to Shuzenji Station, then 8 minutes by bus to Shuzenji Onsen and 1-min walk from there The required times may slightly vary depending on the time of day. | (1) Two hours 10 minutes by JR Limited Express from Tokyo Station to Shuzenji Station, then 8 minutes by bus to Shuzenji Onsen and 1-min walk from there | (2) One hour by bus from Mount Fuji Shizuoka Airport to Shizuoka Station, 25 minutes by JR Shinkansen from Shizuoka Station to Mishima Station, 30 minutes by Izu-Hakone Railway from Mishima Station to Shuzenji Station, then 8 minutes by bus to Shuzenji Onsen and 1-min walk from there;34.9274139;139.045184;https://selected-ryokan.com/ryokan/yukairo-kikuya_izu-shuzenji_shizuoka_tokyo-suburbs.html
Oyado Uchiyama;2-716 Omuro Kogen, Ito, Shizuoka, Japan;52800;82500;1;False;False;False;4.3;['Rooms with private open-air baths', 'All rooms have open-air hot spring', 'Sea view', 'Tokyo suburbs', 'Shizuoka', 'East Izu Onsen'];Book Oyado Uchiyama in East Izu Kogen Highlands Onsen (Shizuoka) Situated at the foot of Mount Omura, this ryokan only has 6 detached two-storey guest rooms in its expansive grounds with an area of 3,300 square metres. All rooms come with an indoor onsen bath and an open-air hot spring bath that commands a spectacular view of the mountains and the sea. Dinner is offered at an individual dining space, while breakfast is served at your own room, and both dinner and breakfast are authentic Japanese-style kaiseki meals. You can feel like putting on the ritz with doing nothing.;(1) Two hours 5 minutes by JR Limited Express from Tokyo Station to Izu-Kogen Station, then 8 minutes by taxi (2) 45 minutes by JR Shinkansen from Tokyo Station to Atami Station, then 50 minutes by JR Ito Line (Izu Kyuko Line) to Izu-Kogen Station and 8-min taxi ride from there The required times may slightly vary depending on the time of day. | (1) Two hours 5 minutes by JR Limited Express from Tokyo Station to Izu-Kogen Station, then 8 minutes by taxi | (2) 45 minutes by JR Shinkansen from Tokyo Station to Atami Station, then 50 minutes by JR Ito Line (Izu Kyuko Line) to Izu-Kogen Station and 8-min taxi ride from there;34.89924908;139.10375121;https://selected-ryokan.com/ryokan/oyado-uchiyama_east-izu-kogen-highlands_shizuoka_tokyo-suburbs.html
Yufuin Hanayoshi;913-11 Yufuin-cho Kawakita, Yufu-shi, Oita, Japan;28600;125400;27;False;False;False;4.4;['Rooms with private open-air baths', 'All rooms have hot spring baths', 'Mountain view', 'Kyushu & Okinawa Region', 'Oita', 'Yufuin Onsen', 'Oita (Oita Airport)'];Book Yufuin Hanayoshi in Yufuin Onsen (Oita) All rooms have hot spring baths. The view of the mountains of Yufu from spots such as the lobby and open-air baths is beautiful. The view is nice. The mystic morning fog can be seen from the lobby.;(1) 55 minutes by bus from Oita Airport to Yufuin Station, (2) one hour 40 minutes by bus from Fukuoka Airport to Yufuin Station, or (3) two hours 10 minutes by JR Limited Express from Hakata Station to Yufuin Station, then 6 minutes by shuttle bus (Advance booking required) The required times may slightly vary depending on the time of day. | (1) 55 minutes by bus from Oita Airport to Yufuin Station, (2) one hour 40 minutes by bus from Fukuoka Airport to Yufuin Station, or (3) two hours 10 minutes by JR Limited Express from Hakata Station to Yufuin Station, then 6 minutes by shuttle bus (Advance booking required);33.260850628494;131.332308059247;https://selected-ryokan.com/ryokan/yufuin-hanayoshi_oita_kyushu.html
Arima Sansoh Gosho Bessho;958-1 Arimacho, Kita-ku, Kobe-shi, Hyogo, Japan;85100;230500;1;False;False;False;4.4;['Rooms with private open-air baths', 'All rooms have hot spring baths', 'Osaka Kyoto Kansai Region', 'Hyogo', 'Arima Onsen'];Book Arima Sansoh Gosho Bessho in Arima Onsen (Hyogo) All rooms are secluded accommodations located in a garden. All rooms are suites and include thermal rooms and hot spring baths.;(1) One hour 5 minutes by bus from Kansai International Airport to Kobe Sannomiya Bus Terminal, then 30 minutes by bus to Arima Onsen and 2-min shuttle bus ride (or 6 minutes on foot) from there (2) One hour by bus from Hankyu Highway Bus Osaka Umeda Terminal (Hankyu Sambangai) to Arima Onsen, then 2 minutes by shuttle bus (or 6 minutes on foot) (3) One hour 15 minutes by bus from Kyoto Station to Arima Onsen, then 2 minutes by shuttle bus (or 6 minutes on foot) (4) 10 minutes by Kobe Municipal Subway from Kobe Sannomiya Station to Tanigami Station, 10 minutes by Kobe Electric Railway from Tanigami Station to Arimaguchi Station, then 5 minutes by Kobe Electric Railway Arima Line to Arima Onsen Station and 4-min shuttle bus ride (or 12 minutes on foot) from there The required times may slightly vary depending on the time of day. | (1) One hour 5 minutes by bus from Kansai International Airport to Kobe Sannomiya Bus Terminal, then 30 minutes by bus to Arima Onsen and 2-min shuttle bus ride (or 6 minutes on foot) from there | (2) One hour by bus from Hankyu Highway Bus Osaka Umeda Terminal (Hankyu Sambangai) to Arima Onsen, then 2 minutes by shuttle bus (or 6 minutes on foot) | (3) One hour 15 minutes by bus from Kyoto Station to Arima Onsen, then 2 minutes by shuttle bus (or 6 minutes on foot) | (4) 10 minutes by Kobe Municipal Subway from Kobe Sannomiya Station to Tanigami Station, 10 minutes by Kobe Electric Railway from Tanigami Station to Arimaguchi Station, then 5 minutes by Kobe Electric Railway Arima Line to Arima Onsen Station and 4-min shuttle bus ride (or 12 minutes on foot) from there;34.7979184;135.2449034;https://selected-ryokan.com/ryokan/arima-sansoh-gosho-bessho_hyogo_kansai.html
Ito Yukitei Kawana Bettei;1385-1 Kawana, Ito City, Shizuoka, Japan;42500;82500;1;False;False;False;4.6;['Rooms with private open-air baths', 'All rooms have open-air hot spring', 'Sea view', 'Tokyo suburbs', 'Shizuoka', 'Ito Onsen'];Book Ito Yukitei Kawana Bettei in Ito Onsen (Shizuoka) It is a luxurious ryokan which only has 5 guest rooms on a 20,000-metre hillside facing the Sagami Sea. All rooms are detached houses with private open-air onsen baths, balconies and indoor hot spring baths. This ryokan offers seafood-based kaiseki meals, and both breakfast and dinner are served in an individual dining room.;(1) One hour 45 minutes by JR Limited Express from Tokyo Station to Ito Station, then 8 minutes by Izu Kyuko Line to Kawana Station and 2-min taxi ride from there (2) 45 minutes by JR Shinkansen from Tokyo Station to Atami Station, then 35 minutes by JR Ito Line (Izu Kyuko Line) to Kawana Station and 2-min taxi ride from there The required times may slightly vary depending on the time of day. | (1) One hour 45 minutes by JR Limited Express from Tokyo Station to Ito Station, then 8 minutes by Izu Kyuko Line to Kawana Station and 2-min taxi ride from there | (2) 45 minutes by JR Shinkansen from Tokyo Station to Atami Station, then 35 minutes by JR Ito Line (Izu Kyuko Line) to Kawana Station and 2-min taxi ride from there;34.946211425097;139.131400491638;https://selected-ryokan.com/ryokan/ito-yukitei-kawana-bettei_izu_shizuoka_tokyo-suburbs.html
Bettei Yaeno;356 Tsunago, Minakami-machi, Tone-gun, Gunma, Japan;36000;44200;1;False;False;False;4.6;['Rooms with private open-air baths', 'All rooms have open-air hot spring', 'Enjoy hot spring in snow', 'Mountain view', 'Tokyo suburbs', 'Gunma', 'Minakami-Tanigawa Onsen'];Book Bettei Yaeno in Minakami Onsen (Gunma) This ryokan, with only 4 guest rooms, is located at Minakami, a rural town at the foot of Mount Tanigawa. All rooms are detached houses equipped with semi-open-air onsen baths facing a spot garden. Both breakfast and dinner are authentic kaiseki meals served in your own room.;(1) One hour 10 minutes by JR Shinkansen from Tokyo Station to Jomo-Kogen Station, then 25 minutes by relay bus to Minakami Station and 10-min taxi ride from there (2) 50 minutes by JR Shinkansen from Tokyo Station to Takasaki Station, one hour 10 minutes by JR Joetsu Line from Takasaki Station to Minakami Station, then 10 minutes by bus to Tsunago and 1-min walk from there The required times may slightly vary depending on the time of day. | (1) One hour 10 minutes by JR Shinkansen from Tokyo Station to Jomo-Kogen Station, then 25 minutes by relay bus to Minakami Station and 10-min taxi ride from there | (2) 50 minutes by JR Shinkansen from Tokyo Station to Takasaki Station, one hour 10 minutes by JR Joetsu Line from Takasaki Station to Minakami Station, then 10 minutes by bus to Tsunago and 1-min walk from there;36.8026798;139.0020453;https://selected-ryokan.com/ryokan/bettei-yaeno_minakami_gunma_tokyo-suburbs.html
Otaru Kourakuen;5-23-1 Shinko, Otaru-shi, Hokkaido, Japan;25300;50100;28;False;True;False;4.5;['Rooms with private open-air baths', 'Rental hot spring baths for private use', 'Enjoy hot spring in snow', 'Japanese garden view', 'Hokkaido Region', 'Hokkaido', 'Sapporo Onsen', 'Otaru Onsen', 'Sapporo (New Chitose Airport)'];Book Otaru Kourakuen in Otaru Onsen (Hokkaido) Twenty-eight rooms that come with open-air baths. At a beautiful and liberating spot facing a 26,000 square-meter Japanese garden.;(1) One hour 10 minutes by JR Limited Express from New Chitose Airport to Otaru-Chikko Station, then 10 minutes by taxi (2) 25 minutes by JR Hakodate Main Line from Sapporo Station to Otaru-Chikko Station, then 10 minutes by taxi The required times may slightly vary depending on the time of day. | (1) One hour 10 minutes by JR Limited Express from New Chitose Airport to Otaru-Chikko Station, then 10 minutes by taxi | (2) 25 minutes by JR Hakodate Main Line from Sapporo Station to Otaru-Chikko Station, then 10 minutes by taxi;43.1755356;141.0582919;https://selected-ryokan.com/ryokan/otaru-korakuen_sapporo_hokkaido.html
Kaike Shogetsu;3-4-25 Kaike Onsen, Yonago-shi, Tottori, Japan;23100;91900;3;True;True;True;4.4;['Rooms with private open-air baths', 'Rental hot spring baths for private use', 'Sea view', 'Hiroshima Chugoku Region', 'Tottori', 'Kaike Onsen (Yonago)', 'Yonago (Yonago Airport)'];Book Kaike Shogetsu in Kaike Onsen (Tottori) Facing the beach right in front of it, Umiiro-Yunoyado Shogetsu is a cosy little ryokan with 19 guest rooms. The open-air bath on the top floor commands a panoramic view of the sea. There are also four rental onsen baths outside the rooms for private use. At night, guests here can enjoy traditional kaiseki meals making use of Tottori Wagyu, a high-class Japanese beef brand unique to Tottori, and local seafoods.;(1) 25 minutes by taxi from Yonago Kitaro Airport (2) Three houre 30 minutes by bus from Osaka Station (or Osaka City Air Terminal) to Yonago Station, then 20 minutes by bus to Kaike Onsen Kanko Center and 2-min shuttle bus ride from there The required times may slightly vary depending on the time of day. | (1) 25 minutes by taxi from Yonago Kitaro Airport | (2) Three houre 30 minutes by bus from Osaka Station (or Osaka City Air Terminal) to Yonago Station, then 20 minutes by bus to Kaike Onsen Kanko Center and 2-min shuttle bus ride from there;35.458516490394;133.362313980871;https://selected-ryokan.com/ryokan/umiiro-yunoyado-shogetsu_kaike_tottori_chugoku.html
Yuyado Daiichi;518 Yoroushi, Nakashibetsu-cho, Shibetsu-gun, Hokkaido, Japan;18900;35500;3;False;True;False;4.6;['Rooms with private open-air baths', 'Rental hot spring baths for private use', 'Enjoy hot spring in snow', 'Interesting hot springs', 'River view', 'Hokkaido Region', 'Hokkaido', 'Yoroushi Onsen (Nakashibetsu)', 'Nemuro (Nakashibetsu Airport)'];Book Yuyado Daiichi in Lake Mashu Nakashibetsu Onsen (Hokkaido) A secluded inn nestled in the heart of nature. Experience a sense of freedom and unity with the natural surroundings in the mixed-gender open-air bath by the river (yuami bathing attire allowed) or the separate large baths for men and women. Dinner features Japanese cuisine made with local ingredients, while a buffet is served for breakfast. Surrounded by nature, you may also have the chance to encounter wild animals such as owls.;(1) 30 minutes by taxi from Nakashibetsu Airport (2) 3 minutes by JR Chitose Line from New Chitose Airport to Minami-Chitose Station, then three hours 30 minutes by JR Limited Express to Kushiro Station and one hours 40-min by car from there The required times may slightly vary depending on the time of day. | (1) 30 minutes by taxi from Nakashibetsu Airport | (2) 3 minutes by JR Chitose Line from New Chitose Airport to Minami-Chitose Station, then three hours 30 minutes by JR Limited Express to Kushiro Station and one hours 40-min by car from there;43.587897104951;144.722427718678;https://selected-ryokan.com/ryokan/yuyado-daiichi_nakashibetsu-onsen_hokkaido.html
Kaze no Tani no Iori;10 Tomine, Ogi, Kota-cho, Nukata-gun, Aichi, Japan;48500;113500;1;False;False;False;4.4;['Rooms with private open-air baths', 'All rooms have open-air hot spring', 'Nagoya Chubu & Hokuriku Region', 'Aichi', 'Mikawa Bay Onsen', 'Nagoya (Chubu Centrair International Airport)'];Book Kaze no Tani no Iori in Gamagori Mikawa Bay Onsen (Aichi) This ryokan was designed in the image of a mountain retreat deep in the forest, and only has 10 guest rooms in the form of detached houses. All rooms come with private open-air baths that make use of natural hot spring water from Gamagori Onsen, as well as balconies that face the forest. Both breakfast and dinner are served in your own room. Tempura cooked right before the guests eyes is also a distinctive characteristic.;(1) 25 minutes by Meitetsu SKY Limited Express from Chubu International Airport (Centrair) to Meitetsu Kanayama Station, then 40 minutes by JR Tokaido Main Line to Gamagori Station and 25-min shuttle bus ride from there (Advance booking required) (2) 40 minutes by JR Tokaido Main Line from Nagoya Station to Gamagori Station, then 25 minutes by shuttle bus from there (Advance booking required) The required times may slightly vary depending on the time of day. | (1) 25 minutes by Meitetsu SKY Limited Express from Chubu International Airport (Centrair) to Meitetsu Kanayama Station, then 40 minutes by JR Tokaido Main Line to Gamagori Station and 25-min shuttle bus ride from there (Advance booking required) | (2) 40 minutes by JR Tokaido Main Line from Nagoya Station to Gamagori Station, then 25 minutes by shuttle bus from there (Advance booking required);34.86005225;137.18867392;https://selected-ryokan.com/ryokan/kaze-no-tani-no-iori_gamagori-mikawa-bay_aichi_nagoya-chubu.html
Hananomaru;17-18 Hazama, Toyohama, Minamichita-cho, Chita-gun, Aichi, Japan;16500;63800;16;True;False;False;3.1;['Rooms with private open-air baths', 'Rental hot spring baths for private use', 'Sea view', 'Nagoya Chubu & Hokuriku Region', 'Aichi', 'Minami Chita Onsen', 'Nagoya (Chubu Centrair International Airport)'];Book Hananomaru in Minami Chita Onsen (Aichi) This ryokan, located on the Chita Peninsula, is right in front of the sea. Guest rooms equipped with open-air baths and the gender-segregated large public baths command a beautiful view of Ise Bay, while 4 rental open-air onsen baths outside the rooms for private use have a delightful outlook of the mountains. Situated near a fishing port, this ryokan provides kaiseki meals that make use of local fresh seafood for dinner. Breakfast is served in a buffet style.;(1) 20 minutes by Meitetsu Tokoname-Airport Line from Chubu Centrair International Airport to Otagawa Station, then 35 minutes by Meitetsu Kowa Line to Kowa Station and 20-min shuttle bus ride from there (Advance booking required) (2) 55 minutes by Meitetsu Tokoname-Airport/Kowa Line from Meitetsu Nagoya Station (next to JR Nagoya Station) to Kowa Station, then 20 minutes by shuttle bus from there (Advance booking required) The required times may slightly vary depending on the time of day. | (1) 20 minutes by Meitetsu Tokoname-Airport Line from Chubu Centrair International Airport to Otagawa Station, then 35 minutes by Meitetsu Kowa Line to Kowa Station and 20-min shuttle bus ride from there (Advance booking required) | (2) 55 minutes by Meitetsu Tokoname-Airport/Kowa Line from Meitetsu Nagoya Station (next to JR Nagoya Station) to Kowa Station, then 20 minutes by shuttle bus from there (Advance booking required);34.700974833547;136.957105303629;https://selected-ryokan.com/ryokan/hananomaru_minamichita_aichi_nagoya-chubu.html
Ibusuki Shusuien;5-27-27 Yunohama,Ibusuki-shi, Kagoshima 891-0406;24200;69300;0;True;False;False;4.3;['Rental hot spring baths for private use', 'Kyushu & Okinawa Region', 'Kagoshima', 'Ibusuki Onsen', 'Kagoshima (Kagoshima Airport)'];Book Ibusuki Shusuien in Ibusuki Onsen (Kagoshima) A hot spring ryokan famous for its food. Number 1 for twenty five years in the food category of 100 Best Ryokans. Near a volcanic sand hot spring.;(1) Two hours by bus from Kagoshima Airport to Ibusuki Station, or (2) one hour 30 minutes by JR Shinkansen from Hakata Station to Kagoshima Chuo Station, then 50 minutes by JR Limited Express to Ibusuki Station and 5-min shuttle bus ride from there (Advance booking required) The required times may slightly vary depending on the time of day. | (1) Two hours by bus from Kagoshima Airport to Ibusuki Station, or (2) one hour 30 minutes by JR Shinkansen from Hakata Station to Kagoshima Chuo Station, then 50 minutes by JR Limited Express to Ibusuki Station and 5-min shuttle bus ride from there (Advance booking required);31.22802520228;130.652245530231;https://selected-ryokan.com/ryokan/ibusuki-shusuien_kagoshima_kyushu.html
Bousui;Hokkawa Onsen, Higashi-Izu-cho, Kamo-gun, Shizuoka, 413-0302 Japan;37400;61600;0;True;False;False;4.4;['Rental hot spring baths for private use', 'All rooms have hot spring baths', 'Sea view', 'Tokyo suburbs', 'Shizuoka', 'East Izu Onsen'];Book Bousui in East Izu Hokkawa Onsen (Shizuoka) Spend private time with the expansive blue ocean and sky. Gazing out at the ocean while bathing in the open air bath is absolutely luxurious. The hot spring features strong potency and a plentiful output of three hundred liters per minute. All rooms have hot spring baths. All rooms offer a view of the ocean.;(1) Two hours 15 minutes by JR Limited Express from Tokyo Station to Izu-Atagawa Station, then 5 minutes by shuttle bus (2) 45 minutes by JR Shinkansen from Tokyo Station to Atami Station, then one hour 5 minutes by JR Ito Line (Izu Kyuko Line) to Izu-Atagawa Station and 5-min shuttle bus ride from there The required times may slightly vary depending on the time of day. | (1) Two hours 15 minutes by JR Limited Express from Tokyo Station to Izu-Atagawa Station, then 5 minutes by shuttle bus | (2) 45 minutes by JR Shinkansen from Tokyo Station to Atami Station, then one hour 5 minutes by JR Ito Line (Izu Kyuko Line) to Izu-Atagawa Station and 5-min shuttle bus ride from there;34.82397049;139.05967445;https://selected-ryokan.com/ryokan/bousui_izu-inatori-hokkawa_shizuoka_tokyo-suburbs.html
Yusuitei Isagoya;1-8-7 Yunohama, Tsuruoka-shi, Yamagata, Japan;25300;56100;4;True;False;False;4.1;['Rooms with private open-air baths', 'Rental hot spring baths for private use', 'Sea view', 'Tohoku Region', 'Yamagata', 'Yunohama Onsen (Tsuruoka & Sakata)', 'Sakata & Tsuruoka (Shonai Airport)'];Book Yusuitei Isagoya in Yunohama Onsen (Yamagata) This onsen ryokan faces the Sea of Japan and is renowned for its stunning sunsets. All guest rooms offer ocean views, including suites with private open-air baths overlooking the sea, as well as standard rooms. Both dinner and breakfast feature traditional Japanese cuisine prepared with vegetables and seafood sourced from the Sea of Japan. The ryokan is also popular as a base for exploring Sakata, Shonai, Tsuruoka, and the Dewa Sanzan, which includes Gassan, Mt. Haguro, and Mt. Yudono.;(1) 12 minutes by taxi from Shonai Airport to Yusuitei Isagoya (2) Two hours by JR Shinkansen from Tokyo Station to Niigata Station, then one hour 50 minutes by JR Limited Express to Tsuruoka Station and 25-min taxi ride from there (3) Two hours 45 minutes by JR Shinkansen from Tokyo Station to Yamagata Station, one hour 50 minutes by bus from Yamagata Station to Tsuruoka S-MALL (Tsuruoka Station), then 45 minutes by bus to Yunohama Onsen and 2-min walk from there The required times may slightly vary depending on the time of day. | (1) 12 minutes by taxi from Shonai Airport to Yusuitei Isagoya | (2) Two hours by JR Shinkansen from Tokyo Station to Niigata Station, then one hour 50 minutes by JR Limited Express to Tsuruoka Station and 25-min taxi ride from there | (3) Two hours 45 minutes by JR Shinkansen from Tokyo Station to Yamagata Station, one hour 50 minutes by bus from Yamagata Station to Tsuruoka S-MALL (Tsuruoka Station), then 45 minutes by bus to Yunohama Onsen and 2-min walk from there;38.779099550461;139.750820873189;https://selected-ryokan.com/ryokan/yusuitei-isagoya_yunohama-onsen_yamagata_tohoku.html
Kayabuki no Sato Yakushi Onsen Hatago;3330-20 Moto Juku, Agatsuma-gun, Higashi Agatsuma-machi, Agatsuma-gun, Gunma, 377-0933 Japan;25300;50100;1;False;False;False;4.1;['Rooms with private open-air baths', 'Enjoy hot spring in snow', 'Traditional Japanese architecture', 'Waterfall view', 'Rural landscape', 'Tokyo suburbs', 'Gunma', 'Shima Onsen'];Book Kayabuki no Sato Yakushi Onsen Hatago in Shima Onsen (Gunma) Travel back in time to an old style village. Stay in one of the thatched roof abodes scattered about the premises. Open-air hot spring baths by a waterfall.;;36.498843024717;138.681759079304;https://selected-ryokan.com/ryokan/kayabuki-no-sato-yakushi-onsen-hatago_gunma_tokyo-suburbs.html
