name;location;price_range_min;price_range_max;room_with_open_air_bath;rental_open_air_tubs;rental_indoor_tubs;rental_both_indoor_outdoor_tubs;tripadvisor_rating;tags;description;transportation;lat;lon;url
Sumiya Kiho-an, Kameoka Yunohana;25 Miyanooku, Hiedano-cho, Kakihana, Kameoka-shi, Kyoto, Japan;31900;77000;10;True;False;False;4.3;['Rooms with private open-air baths', 'Rental hot spring baths for private use', 'Mountain view', 'Osaka Kyoto Kansai Region', 'Kyoto', 'Kyoto Onsen'];Book Sumiya Kiho-an in Kyoto Kameoka Yunohana Onsen You can enjoy authentic kaiseki meals prepared by professional chefs of Kyoto cuisine in a relaxing space. This ryokan has several different types of guest rooms, including those equipped with open-air onsen baths. Aside from the gender-segregated public open-air baths, there is also a quaint rental open-air bath for private use, designed under the theme of a hidden onsen deep in the mountains.;;35.021812964707;135.505993177884;https://selected-ryokan.com/ryokan/sumiya-kiho-an_kyoto_kansai.html
Toshoan;1044-1 Kawaminami, Yufuin-cho, Yufu-shi, Oita, Japan;30800;52800;2;False;False;False;4.0;['Rooms with private open-air baths', 'All rooms have hot spring baths', 'Safe ryokans under the COVID-19 (coronavirus) pandemic', 'Mountain view', 'Kyushu & Okinawa Region', 'Oita', 'Yufuin Onsen', 'Oita (Oita Airport)'];Book Toshoan in Yufuin Onsen (Oita) Located at a distance from central Yufuin, this ryokan has 8 guest rooms, and boasts a delightful outlook. You can take in the views of the magnificent Mount Yufu and rural landscapes from the guest rooms or the hot spring baths inside the rooms. All rooms have hot spring baths.;(1) 55 minutes by bus from Oita Airport to Yufuin Station, (2) one hour 40 minutes by bus from Fukuoka Airport to Yufuin Station, or (3) two hours 10 minutes by JR Limited Express from Hakata Station to Yufuin Station, then 5 minutes by Minato Taxi The required times may slightly vary depending on the time of day. | (1) 55 minutes by bus from Oita Airport to Yufuin Station, (2) one hour 40 minutes by bus from Fukuoka Airport to Yufuin Station, or (3) two hours 10 minutes by JR Limited Express from Hakata Station to Yufuin Station, then 5 minutes by Minato Taxi;33.21148576;131.56936642;https://selected-ryokan.com/ryokan/tosyoan_yufuin_oita_kyushu.html
Kaike Yugetsu;3-11-1 Kaike Onsen, Yonago-shi, Tottori, Japan;28900;81400;1;False;False;False;4.4;['Rooms with private open-air baths', 'All rooms have open-air hot spring', 'Sea view', 'Hiroshima Chugoku Region', 'Tottori', 'Kaike Onsen (Yonago)', 'Yonago (Yonago Airport)'];Book Kaike Yugetsu in Kaike Onsen (Tottori) Ocean view from all guest rooms. There are two types of rooms 1. suites larger than 120 m2, all equipped with open-air baths, and 2. standard Japanese rooms (washitsu) with open-air baths.;(1) 25 minutes by taxi from Yonago Kitaro Airport (2) Three houre 30 minutes by bus from Osaka Station (or Osaka City Air Terminal) to Yonago Station, then 20 minutes by bus to Kaike Onsen Kanko Center and 2-min shuttle bus ride from there The required times may slightly vary depending on the time of day. | (1) 25 minutes by taxi from Yonago Kitaro Airport | (2) Three houre 30 minutes by bus from Osaka Station (or Osaka City Air Terminal) to Yonago Station, then 20 minutes by bus to Kaike Onsen Kanko Center and 2-min shuttle bus ride from there;35.4564289;133.3659397;https://selected-ryokan.com/ryokan/kaike-yugetsu_tottori_chugoku.html
Kitakobushi Shiretoko Hotel & Resort;172 Utoro Higashi, Shari-cho, Shari-gun, Hokkaido, 099-4355 Japan;18800;102300;1;False;False;False;4.2;['Rooms with private open-air baths', 'Enjoy hot spring in snow', 'Sea view', 'Hokkaido Region', 'Hokkaido', 'Shiretoko (Utoro) Onsen', 'Abashiri (Memanbetsu Airport)', 'Nemuro (Nakashibetsu Airport)'];Book Kitakobushi Shiretoko Hotel & Resort in Shiretoko (Utoro) Onsen (Hokkaido) Shiretoko, a World Natural Heritage site. There is a harbor right in front of you where drift ice floats to around February. Enjoy hot springs while experiencing one of Japans northernmost ocean areas.;(1) Two hours 10 minutes by bus* from Memanbetsu Airport to Utoro Onsen Bus Terminal, then 5 minutes on foot (*Operation period: Mid-January early March, June September) (2) Seven hours 20 minutes by bus from Sapporo Bus Terminal to Kitakobushi Shiretoko Hotel & Resort, then right over there (Advance booking required) (3) One hour 30 minutes by taxi from Nakashibetsu Airport The required times may slightly vary depending on the time of day. | (1) Two hours 10 minutes by bus* from Memanbetsu Airport to Utoro Onsen Bus Terminal, then 5 minutes on foot (*Operation period: Mid-January early March, June September) | (2) Seven hours 20 minutes by bus from Sapporo Bus Terminal to Kitakobushi Shiretoko Hotel & Resort, then right over there (Advance booking required) | (3) One hour 30 minutes by taxi from Nakashibetsu Airport;44.0746679;144.9999833;https://selected-ryokan.com/ryokan/shiretoko-grand-hotel-kita-kobushi_utoro_hokkaido.html
Houshi Onsen Chojukan;650 Nagai, Minakai-cho, Tone-gun, Gunma 379-1401 Japan;18700;50100;0;False;False;False;4.4;['Enjoy hot spring in snow', 'Interesting hot springs', 'Traditional Japanese architecture', 'Mountain view', 'Tokyo suburbs', 'Gunma', 'Minakami-Tanigawa Onsen'];Book Houshi Onsen Chojukan in Minakami Tanigawa Onsen (Gunma) A hidden bath set along a stream running through the bountiful deep mountain greenery. This famous spring was popular amongst the intellectual poet-painters (bunjin) of yore. An inn that has been in business for over hundred forty years.;;36.744148138326;138.830275842375;https://selected-ryokan.com/ryokan/houshi-onsen-chojukan_minakami_gunma_tokyo-suburbs.html
Yukemurinosato Kashiwaya;62 Kawajionsen Takahara, Nikko-shi, Tochigi, Japan;16500;73700;2;False;False;True;4.1;['Rooms with private open-air baths', 'Rental hot spring baths for private use', 'River view', 'Tokyo suburbs', 'Tochigi', 'Kinugawa Onsen'];Book Yukemurinosato Kashiwaya in Kawaji Kinugawa Onsen (Tochigi) There are scenic open-air hot spring baths facing the river. With 2 types of private-use hot spring baths. 1 hour by train to Nikko Toshogu Shrine, a UNESCO World Heritage Site.;;36.893184369846;139.705850034815;https://selected-ryokan.com/ryokan/yukemurinosato-kashiwaya_nikko-kinugawa_tochigi_tokyo-suburbs.html
Miyama Ouan;229 Hirayu, Okuhida Onsengo, Takayama City, Gifu, Japan;20500;73300;8;True;True;False;3.9;['Rooms with private open-air baths', 'Rental hot spring baths for private use', 'Enjoy hot spring in snow', 'Mountain view', 'Nagoya Chubu & Hokuriku Region', 'Gifu', 'Okuhida Onsen'];Book Miyama Ouan in Hirayu Okuhida Onsen (Gifu) It is very atmospheric with its surrounding natural environment in the bosom of a mountain. The view of the mountain from spots such as the room and open-air baths is beautiful. With four types of private-use hot spring baths.;(1) Two hours 30 minute by JR Limited Express from Nagoya Station to Takayama Station, then one hour by bus to Hirayu Onsen and 2-min shuttle bus ride (or 7-min walk) from there (2) Two hours 50 minute by bus from Nagoya Meitetsu Bus Center to Takayama Nohi Bus Center, then one hour by bus to Hirayu Onsen and 2-min shuttle bus ride (or 7-min walk) from there (3) Four hours 40 minute by bus from Shinjuku Expressway Bus Terminal to Hirayu Onsen, then 2 minute by shuttle bus (or 7 minute on foot) The required times may slightly vary depending on the time of day. | (1) Two hours 30 minute by JR Limited Express from Nagoya Station to Takayama Station, then one hour by bus to Hirayu Onsen and 2-min shuttle bus ride (or 7-min walk) from there | (2) Two hours 50 minute by bus from Nagoya Meitetsu Bus Center to Takayama Nohi Bus Center, then one hour by bus to Hirayu Onsen and 2-min shuttle bus ride (or 7-min walk) from there | (3) Four hours 40 minute by bus from Shinjuku Expressway Bus Terminal to Hirayu Onsen, then 2 minute by shuttle bus (or 7 minute on foot);36.14603729;137.25220489;https://selected-ryokan.com/ryokan/miyama-ouan_oku-hida_gifu_nagoya-chubu-hokuriku.html
Hotel Saginoyu;3-2-14 Kogan-dori, Suwa-shi, Nagano, Japan;17300;46800;7;False;False;False;3.8;['Rooms with private open-air baths', 'Lake view', 'Tokyo suburbs', 'Nagano', 'Lake Suwa & Tateshina Onsen'];Book Hotel Saginoyu in Lake Suwa Onsen (Nagano) This century-old onsen ryokan is situated at the edge of Lake Suwa and has 49 guest rooms. You can enjoy the onsen coming from the ryokans own spring source at the gender-segregated public open-air baths, as well as in the seven guest rooms which come with their own private open-air hot spring baths. This ryokan also offers a wide range of facilities, including a courtyard with footbath and a gallery of Japanese-style paintings.;;36.048849698179;138.113172761217;https://selected-ryokan.com/ryokan/hotel-saginoyu_lake-suwa_nagano_tokyo-suburbs.html
Kappo Ryokan Wakamatsu;1-2-27 Yunokawa-cho, Hakodate-shi, Hokkaido, Japan;26400;112200;0;False;False;False;4.5;['Sea view', 'Hokkaido Region', 'Hokkaido', 'Hakodate Yunokawa Onsen', 'Hakodate (Hakodate Airport)'];Book Kappo Ryokan Wakamatsu in Hakodate Yunokawa Onsen (Hokkaido) All rooms offer a view of the ocean. The panoramic view of the Tsugaru Channel expands right in front of you. The view of the sea from the open-air baths is beautiful. Awarded 1 Star in Michelin Guide Hokkaido.;(1) 8 minutes by bus from Hakodate Airport to Yunokawa Onsen, then 2 minutes on foot from there (2) Five hours 50 minutes by bus from Sapporo Station to Yunokawa Onsen, then 2 minutes on foot (3) Three hours 45 minutes by JR Limited Express from Sapporo Station to Hakodate Station, then 30 minutes by Hakodate City Tram to Yunokawa Onsen Station, and 5-min walk from there (4) 3 minutes by JR Chitose Line from New Chitose Airport to Minami-Chitose Station, then three hours 15 minutes by JR Limited Express to Hakodate Station and 13-min taxi ride from there The required times may slightly vary depending on the time of day. | (1) 8 minutes by bus from Hakodate Airport to Yunokawa Onsen, then 2 minutes on foot from there | (2) Five hours 50 minutes by bus from Sapporo Station to Yunokawa Onsen, then 2 minutes on foot | (3) Three hours 45 minutes by JR Limited Express from Sapporo Station to Hakodate Station, then 30 minutes by Hakodate City Tram to Yunokawa Onsen Station, and 5-min walk from there | (4) 3 minutes by JR Chitose Line from New Chitose Airport to Minami-Chitose Station, then three hours 15 minutes by JR Limited Express to Hakodate Station and 13-min taxi ride from there;41.774364729307;140.785086872422;https://selected-ryokan.com/ryokan/wakamatsu_hakodate_yunokawa_hokkaido.html
Kasuitei;4-19-10 Kaike Onsen, Yonago-shi, Tottori, 683-0001 Japan;17600;107800;8;True;False;False;4.0;['Rooms with private open-air baths', 'Rental hot spring baths for private use', 'Sea view', 'Hiroshima Chugoku Region', 'Tottori', 'Kaike Onsen (Yonago)', 'Yonago (Yonago Airport)'];Book Kasuitei in Kaike Onsen (Tottori) We are especially proud of our four types of private open air bath and the large bathing area that looks out onto the Sea of Japan.;(1) 25 minutes by taxi from Yonago Kitaro Airport (2) Three houre 30 minutes by bus from Osaka Station (or Osaka City Air Terminal) to Yonago Station, then 20 minutes by bus to Kaike Onsen Kanko Center and 2-min shuttle bus ride from there The required times may slightly vary depending on the time of day. | (1) 25 minutes by taxi from Yonago Kitaro Airport | (2) Three houre 30 minutes by bus from Osaka Station (or Osaka City Air Terminal) to Yonago Station, then 20 minutes by bus to Kaike Onsen Kanko Center and 2-min shuttle bus ride from there;35.458611624995;133.357720027379;https://selected-ryokan.com/ryokan/kasuitei_kaike_tottori_chugoku.html
Nonohanatei Komurasaki;1-5-30 Nishi Hongo, Shimoda-shi, Shizuoka, Japan;25900;58300;1;False;False;False;4.0;['Rooms with private open-air baths', 'All rooms have open-air hot spring', 'Safe ryokans under the COVID-19 (coronavirus) pandemic', 'Tokyo suburbs', 'Shizuoka', 'South Izu Onsen'];Book Nonohanatei Komurasaki in South Izu Shimoda Onsen (Shizuoka) Despite its convenient location that is just a three-minute walk from the Izukyu-Shimoda Station, this five-room ryokan has a calm atmosphere. All guest rooms are washitsu (traditional Japanese-style rooms), and each has an indoor cypress bath and an open-air izu-ishi (a type of precious stone unique to Izu) bath. Guests can enjoy kaiseki meals in their own rooms.;(1) Two hours 40 minutes by JR Limited Express from Tokyo Station to Izukyu-Shimoda Station, then 3 minutes on foot (2) 45 minutes by JR Shinkansen from Tokyo Station to Atami Station, then one hour 30 minutes by JR Ito Line (Izu Kyuko Line) to Izukyu-Shimoda Station and 3-min walk from there The required times may slightly vary depending on the time of day. | (1) Two hours 40 minutes by JR Limited Express from Tokyo Station to Izukyu-Shimoda Station, then 3 minutes on foot | (2) 45 minutes by JR Shinkansen from Tokyo Station to Atami Station, then one hour 30 minutes by JR Ito Line (Izu Kyuko Line) to Izukyu-Shimoda Station and 3-min walk from there;34.680678767469;138.943383004024;https://selected-ryokan.com/ryokan/nonohanatei-komurasaki_south-izu-shimoda_shizuoka_tokyo-suburbs.html
Kinugawa Grand Hotel Yume no Toki;1021 Ohara, Kinugawa Onsen, Nikko-shi, Tochigi, 321-2522 Japan;25300;123200;0;True;False;False;3.9;['Rental hot spring baths for private use', 'Tokyo suburbs', 'Tochigi', 'Kinugawa Onsen'];Book Kinugawa Grand Hotel Yume no Toki in Kinugawa Onsen (Tochigi) A quiet and secluded high-ground hotel situated around a Japanese garden. 40 minutes by train or taxi to Nikko Toshogu Shrine, a UNESCO World Heritage Site.;;36.824590688024;139.721397040282;https://selected-ryokan.com/ryokan/kinugawa-grand-hotel-yume-no-toki_nikko-kinugawa_tochigi_tokyo-suburbs.html
Nippon no Yado Koyo;5-20 Hayama, Kaminoyama-shi, Yamagata, 999-3242 Japan;19800;88000;37;True;False;False;4.0;['Rooms with private open-air baths', 'Rental hot spring baths for private use', 'Enjoy hot spring in snow', 'Tohoku Region', 'Yamagata', 'Kaminoyama Onsen (Zao)', 'Yamagata (Yamagata Airport)'];Book Nippon no Yado Koyo in Zao-Kaminoyama Onsen (Yamagata) The hot spring is one of the three major hot springs of beauty in Japan, and the cuisine features the famous wagyu, Yonezawa beef. 25 minutes by taxi to Zao.;(1) 35 minutes by bus from Yamagata Airport to Yamagata Station, then 10 minutes by JR Ou Main Line to Kaminoyama Onsen Station and 10-min shuttle bus ride from there (2) Two hours 30 minutes by JR Shinkansen from Tokyo Station to Kaminoyama Onsen Station, then 10 minutes by shuttle bus The required times may slightly vary depending on the time of day. | (1) 35 minutes by bus from Yamagata Airport to Yamagata Station, then 10 minutes by JR Ou Main Line to Kaminoyama Onsen Station and 10-min shuttle bus ride from there | (2) Two hours 30 minutes by JR Shinkansen from Tokyo Station to Kaminoyama Onsen Station, then 10 minutes by shuttle bus;38.147974469768;140.261367624747;https://selected-ryokan.com/ryokan/nippon-no-yado-koyo_zao_yamagata_tohoku.html
Nemu no Hana;2711 Gonohara, Kitago-cho, Nichinan-shi, Miyazaki, Japan;43000;132000;1;False;False;False;4.4;['Rooms with private open-air baths', 'All rooms have open-air hot spring', 'Safe ryokans under the COVID-19 (coronavirus) pandemic', 'Kyushu & Okinawa Region', 'Miyazaki', 'Nichinan Onsen', 'Miyazaki (Miyazaki Airport)'];Book Nemu no Hana in Nichinan Onsen (Miyazaki) All rooms are secluded accommodations located in a garden. All rooms include both open-air and indoor hot spring baths. All rooms face the river.;(1) 2 minutes by JR Miyazaki Airport Line from Miyazaki Airport to Tayoshi Station, then 50 minutes by JR Nichinan Line to Kitago Station and 10-min shuttle bus ride from there (Advance booking required) (2) Four hours 30 minutes by bus from Hakata Bus Terminal to Miyako City (Minami-Miyazaki Station), then 55 minutes by JR Nichinan Line to Kitago Station and 10-min shuttle bus ride from there (Advance booking required) The required times may slightly vary depending on the time of day. | (1) 2 minutes by JR Miyazaki Airport Line from Miyazaki Airport to Tayoshi Station, then 50 minutes by JR Nichinan Line to Kitago Station and 10-min shuttle bus ride from there (Advance booking required) | (2) Four hours 30 minutes by bus from Hakata Bus Terminal to Miyako City (Minami-Miyazaki Station), then 55 minutes by JR Nichinan Line to Kitago Station and 10-min shuttle bus ride from there (Advance booking required);31.60181969;131.37873941;https://selected-ryokan.com/ryokan/nemu-no-hana_kitago_miyazaki_kyushu.html
Yumoto Saito Ryokan;4195, Shirahone-Onsen, Azumi, Matsumoto-shi, Nagano 390-1515 Japan;24200;52800;1;False;True;False;4.3;['Rooms with private open-air baths', 'Rental hot spring baths for private use', 'Enjoy hot spring in snow', 'Traditional Japanese architecture', 'Mountain view', 'Tokyo suburbs', 'Nagano', 'Shirahone Onsen'];Book Yumoto Saito Ryokan in Shirahone Onsen (Nagano) As an old ryokan established in 1738, it is situated in the Shirahone Onsen which is popular as a hidden hot spring resort deep in the mountains. The milky white spring water at the large public baths, open-air baths, and rental baths outside the rooms for private use comes from the ryokans own spring source. There are 51 guest rooms in three building linked by a cloister, and all rooms command a splendid view of the magnificent nature.;(1) Two hours 40 minutes by JR Limited Express from Shinjuku Station to Matsumoto Station, 30 minutes by Kamikochi Line from Matsumoto Station to Shinshimashima Station, then 55 minutes by bus to Shirahone Onsen and 6-min walk from there (2) Three hours 20 minutes by bus from Shinjuku Expressway Bus Terminal (Busta Shinjuku) to Matsumoto Bus Terminal (near Matsumoto Station), 30 minutes by Kamikochi Line from Matsumoto Station to Shinshimashima Station, then 55 minutes by bus to Shirahone Onsen and 6-min walk from there (3) Two hours 5 minutes by JR Limited Express from Nagoya Station to Matsumoto Station, 30 minutes by Kamikochi Line from Matsumoto Station to Shinshimashima Station, then 55 minutes by bus to Shirahone Onsen and 6-min walk from there The required times may slightly vary depending on the time of day. | (1) Two hours 40 minutes by JR Limited Express from Shinjuku Station to Matsumoto Station, 30 minutes by Kamikochi Line from Matsumoto Station to Shinshimashima Station, then 55 minutes by bus to Shirahone Onsen and 6-min walk from there | (2) Three hours 20 minutes by bus from Shinjuku Expressway Bus Terminal (Busta Shinjuku) to Matsumoto Bus Terminal (near Matsumoto Station), 30 minutes by Kamikochi Line from Matsumoto Station to Shinshimashima Station, then 55 minutes by bus to Shirahone Onsen and 6-min walk from there | (3) Two hours 5 minutes by JR Limited Express from Nagoya Station to Matsumoto Station, 30 minutes by Kamikochi Line from Matsumoto Station to Shinshimashima Station, then 55 minutes by bus to Shirahone Onsen and 6-min walk from there;36.155482007263;137.625031842676;https://selected-ryokan.com/ryokan/yumoto-saito-ryokan_shirahone_nagano_tokyo-suburbs.html
Ryokan Ichinomatsu;1-3-17 Yunokawa-cho, Hakodate-shi, Hokkaido, 042-0932 Japan;16000;76000;0;False;False;False;4.3;['Hokkaido Region', 'Hokkaido', 'Hakodate Yunokawa Onsen', 'Hakodate (Hakodate Airport)'];Book Ryokan Ichinomatsu in Hakodate Yunokawa Onsen (Hokkaido) The relaxing atmosphere of a traditional Japanese environment facing off against a Japanese style garden.;(1) 7 minutes by shuttle bus from Hakodate Airport (Advance booking required) (2) 8 minutes by bus from Hakodate Airport to Yunokawa Onsen, then 3 minutes on foot (3) Three hours 45 minutes by JR Limited Express from Sapporo Station to Hakodate Station, then 30 minutes by Hakodate City Tram to Yunokawa Onsen Station and 3-min walk from there (4) 3 minutes by JR Chitose Line from New Chitose Airport to Minami-Chitose Station, then three hours 15 minutes by JR Limited Express to Hakodate Station and 15-min taxi ride from there The required times may slightly vary depending on the time of day. | (1) 7 minutes by shuttle bus from Hakodate Airport (Advance booking required) | (2) 8 minutes by bus from Hakodate Airport to Yunokawa Onsen, then 3 minutes on foot | (3) Three hours 45 minutes by JR Limited Express from Sapporo Station to Hakodate Station, then 30 minutes by Hakodate City Tram to Yunokawa Onsen Station and 3-min walk from there | (4) 3 minutes by JR Chitose Line from New Chitose Airport to Minami-Chitose Station, then three hours 15 minutes by JR Limited Express to Hakodate Station and 15-min taxi ride from there;41.775781103305;140.785805704438;https://selected-ryokan.com/ryokan/ryokan-ichinomatsu_hakodate-yunokawa_hokkaido.html
Yunoshimakan;645 Yunoshima, Gero-shi, Gifu, 509-2207 Japan;30900;63000;1;False;True;False;4.3;['Rooms with private open-air baths', 'Rental hot spring baths for private use', 'Enjoy hot spring in snow', 'Traditional Japanese architecture', 'Mountain view', 'Japanese garden view', 'Nagoya Chubu & Hokuriku Region', 'Gifu', 'Gero Onsen'];Book Yunoshimakan in Gero Onsen (Gifu) Occupying an area of 165,000 square metres, it is an old, traditional onsen ryokan nestling in the mountains. Located on an upland, it affords a commanding view of Gero Onsens townscape. The three-storied wooden main building was designated as a registered tangible cultural property of Japan. Its guest rooms are washitsu (Japanese-style rooms) of which many are equipped with open-air onsen baths. Gender-segregated large public scenic baths, open-air scenic baths, and a rental bath outside the rooms for private use are also available. As to dining, you can enjoy authentic kaiseki meals in your own room. All rooms equipped with hot springs bath, except for the main building rooms not equipped with a bathtub.;;35.8133325;137.2391001;https://selected-ryokan.com/ryokan/yunoshimakan_gero_gifu_nagoya-chubu-hokuriku.html
Ichinoyu Katei;2219 Hirao, Yamanouchi Town, Shimotakai-gun, Nagano, Japan;18200;31300;0;False;True;False;4.5;['Rental hot spring baths for private use', 'Enjoy hot spring in snow', 'Tokyo suburbs', 'Nagano', 'Yudanaka-Shibu Onsen (Snow Monkey)'];Book Ichinoyu Katei in Shibu Onsen (Nagano) A cozy little establishment with a total of 11 rooms. As well as its guest rooms, the shared space is straw-matted. Hot spring resort adjacent to Jigokudani Yaen-koen known for snow monkeys.;(1) One hour 30 minute by JR Hokuriku Shinkansen from Tokyo Station to Nagano Station, then 45 minute by Nagano Electric Railway to Yudanaka Station and 7-min shuttle bus ride from there (Advance booking required) (2) Two hours 50 minute by JR Limited Express from Nagoya Station to Nagano Station, then 45 minute by Nagano Electric Railway to Yudanaka Station and 7-min shuttle bus ride from there (Advance booking required) The required times may slightly vary depending on the time of day. | (1) One hour 30 minute by JR Hokuriku Shinkansen from Tokyo Station to Nagano Station, then 45 minute by Nagano Electric Railway to Yudanaka Station and 7-min shuttle bus ride from there (Advance booking required) | (2) Two hours 50 minute by JR Limited Express from Nagoya Station to Nagano Station, then 45 minute by Nagano Electric Railway to Yudanaka Station and 7-min shuttle bus ride from there (Advance booking required);36.734661877497;138.433271189422;https://selected-ryokan.com/ryokan/ichinoyu-katei_snow-monkey_yudanaka-shibu_nagano.html
Masuya;2296 Hirao, Yamanouchi-machi, Shimotakai-gun, Nagano, Japan;16500;44000;4;True;False;False;4.6;['Rooms with private open-air baths', 'Rental hot spring baths for private use', 'Enjoy hot spring in snow', 'Tokyo suburbs', 'Nagano', 'Yudanaka-Shibu Onsen (Snow Monkey)'];Book Masuya in Yudanaka Onsen (Nagano) An inn that has been in business for over 140 years. Four rooms that come with open-air baths. Hot spring resort adjacent to Jigokudani Yaen-koen known for snow monkeys.;(1) One hour 30 minute by JR Hokuriku Shinkansen from Tokyo Station to Nagano Station, then 45 minute by Nagano Electric Railway to Yudanaka Station and 3-min shuttle bus ride from there (Advance booking required) (2) Two hours 50 minute by JR Limited Express from Nagoya Station to Nagano Station, then 45 minute by Nagano Electric Railway to Yudanaka Station and 3-min shuttle bus ride from there (Advance booking required) The required times may slightly vary depending on the time of day. | (1) One hour 30 minute by JR Hokuriku Shinkansen from Tokyo Station to Nagano Station, then 45 minute by Nagano Electric Railway to Yudanaka Station and 3-min shuttle bus ride from there (Advance booking required) | (2) Two hours 50 minute by JR Limited Express from Nagoya Station to Nagano Station, then 45 minute by Nagano Electric Railway to Yudanaka Station and 3-min shuttle bus ride from there (Advance booking required);36.710879;138.503181;https://selected-ryokan.com/ryokan/masuya_snow-monkey_yudanaka-shibu_nagano.html
